### ISSUE TITLE
On listen / accept, there's wait for anything from the other side before a write kicks in

### ISSUE THREAD

**Issue by hannesm** [robur-coop/utcp#23]
Setup is a:

`listen (fun flow -> write (Cstruct.of_string "hello"))` -- but from the network dump:

```
19:55:54.762608 IP 192.168.23.1.14000 > 192.168.23.3.80: Flags [S], seq 2361366649, win 65535, options [mss 1460,nop,wscale 6,sackOK,TS val 3782072655 ecr 0], length 0
19:55:54.763031 IP 192.168.23.3.80 > 192.168.23.1.14000: Flags [S.], seq 3790502476, ack 2361366650, win 65535, options [mss 1460,wscale 6,eol], length 0
19:55:54.763055 IP 192.168.23.1.14000 > 192.168.23.3.80: Flags [.], ack 1, win 1027, length 0
19:55:54.763410 IP 192.168.23.3.80 > 192.168.23.1.14000: Flags [.], ack 1, win 4096, length 0
# below:
19:55:55.421299 IP 192.168.23.1.14000 > 192.168.23.3.80: Flags [P.], seq 1:3, ack 1, win 1027, length 2: HTTP
19:55:55.421660 IP 192.168.23.3.80 > 192.168.23.1.14000: Flags [FP.], seq 1:6, ack 3, win 4095, length 5: HTTP
19:55:55.421688 IP 192.168.23.1.14000 > 192.168.23.3.80: Flags [.], ack 7, win 1027, length 0
19:55:55.421791 IP 192.168.23.1.14000 > 192.168.23.3.80: Flags [F.], seq 3, ack 7, win 1027, length 0
19:55:55.422166 IP 192.168.23.3.80 > 192.168.23.1.14000: Flags [.], ack 4, win 4095, length 0
```

Although the server side emits eventually the data, it does wait for the client to send a packet (see line below marked `below:`). It could just send the data and be done with it.
